{
  "$schema": "http://json-schema.org/draft-07/schema#",
  "type": "object",
  "required": ["id", "name", "price", "stock"],
  "additionalProperties": false,
  "properties": {
    "id": {"type": "integer", "minimum": 1},
    "name": {"type": "string", "minLength": 1},
    "price": {"type": "number", "exclusiveMinimum": 0},
    "stock": {"type": "integer", "minimum": 0}
  }
}
